{"algorithm":"sha256","fileCount":2,"files":[{"digest":"b6a98d9ce9a2d9149288fa3df42d377c3e42737afdcdaf714e33c0a100b51060","path":"a.txt","size":6},{"digest":"5da8f23decf397b13f4f55b6fb8a61936238bfe08ed9d901132974f1beccc45c","path":"subdir/b.txt","size":6}],"root":"REPLACE_ME","treeDigest":"ba6e2574f0577ea62632a8938d7abdc2c6650af13bea6c686952a635efbc9e17"}
